review_text,review_translater_face,polaridadeMultiClassifierTweetsOriginal,polaridadeMultiClassifierTweetsTraduzido,polaridade
"oi boa noite, quero saber se vao devolver o dinheiro, eu mandei o produto ficou faltando a pistola e quero saber se vao me restituir pq ainda estao cobrando no cartao de credito","Oh good night, I want to know if I will return the money, I sent the product was missing the gun and I want to know if I will return me pq I am still charging on the credit card",0.0,0.0,0.0
Não recomendo pois ela só funciona com Wi-Fi dela é na maioria das vezes não conecta e você tem que baixar um app difícil de encontrar pois no manual que está em chinês e russo não te ajuda em nada. Por isso não recomendo.,I don't recommend because it only works with Wi-Fi it's most often not connected and you have to download an app hard to find because in the manual that's in Chinese and Russian doesn't help you in anything.,-1.0,-1.0,0.0
"O produto é bom. Mas o pano fica sempre com água, não tem absorção de água direito ao torcer.  Mas é um produto prático para dia dia.","The product is good. But the plate is always with water, it has no right water absorption when it turns. But it is a practical product for day-to-day.",0.0,0.0,0.0
"Bonita e fácil de carregar, porém não mantém os alimentos quentes.","Beautiful and easy to carry, but does not keep the food hot.",-1.0,-1.0,0.0
"Infelizmente estou com problemas, pois não consegui receber o produto dentro do prazo, está com 13 dias de atraso.","Unfortunately I'm in trouble because I couldn't get the product within the deadline, it's 13 days late.",-1.0,-1.0,0.0
"ja reclamei e não tive resposta , agora quero cancelar e quero meu dinheiro com juros e correção  NÃO RECEBI O PRODUTO ATÉ AGROA","I've already complained and I didn't have a reply, now I want to cancel and I want my money with interest and correction I don't receive the PRODUCT AT GROA",-1.0,-1.0,0.0
Bonito produto...mas de pouca utilidade...a anatomia dela fica difícil de usar...,"It’s a good product, but it’s little useful, and its anatomy is hard to use.",-1.0,-1.0,0.0
Já deu defeito por isso avalio como péssimo. Não recomendo para meus amigos,"I’ve had a mistake, so I’m evaluating it as bad. I don’t recommend it to my friends",-1.0,-1.0,0.0
"a descrição da caixa do produto diz 28 cm , porém não tem.","The description of the product box says 28 cm, but it does not.",0.0,0.0,0.0
"Cadeira veio com defeito no hidráulico, dois rasgos, torta e amassado no apoio de pés. Até agora não consegui solucionar o problema. Já conversei com atendente e fui comunicado que iriam resolver o problema. Porém a única maneira de resolver é enviar uma nova e trocar por esta que está comigo. Mas até agora nada.","The chair came with a defect in the hydraulic, two traits, cake and gathered in the support of the feet. So far I couldn't solve the problem. I've already talked with the assistant and I've been communicated that they'd solve the problem. But the only way to solve is to send a new and exchange for this that's with me. But so far nothing.",-1.0,-1.0,0.0
O pen drive que recebi foi diferente do que comprei. Comprei um produto e veio outro.,The pen drive I received was different from what I bought. I bought one product and came another.,0.0,0.0,0.0
Ainda não recebi o produto. Não tenho como avaliar um produto que ainda nao recebi.,I have not yet received the product.I have no way to evaluate a product that I have not yet received.,-1.0,0.0,0.0
"ESSE PRODUTO NÃO CHEGOU EM MINHA RESIDÊNCIA!!!!!! Descontaram o valor em meu cartão, o produto não chegou em minha residência.  Fui noite dos correios e está com endereço final sendo SÃO PAULO, porém meu endereço é no RIO DE JANEIRO.  Quero meu dinheiro de volta ou o produto!!","This product did not come to my residence!!!!!! they discounted the value on my card, the product did not come to my residence. I was the night of the mail and is with the end address being SÃO PAULO but my address is in RIO DE JANEIRO. I want my money back or the product!!",-1.0,-1.0,0.0
me arrependi de ter comprado o acabamento mal feito dos garfos corta a boca. não compre,I regret having bought the wrong-made finish of the butterflies cut the mouth.,-1.0,-1.0,0.0
"Não compremm .. com apenas 2 meses a camera ja deu pau .. não foca mais, entre outras coisas ..","I don't buy.. with only 2 months the camera has already pau.. no focus anymore, among other things..",-1.0,-1.0,0.0
Eu recebi o produto sujo e desbotado... Não recomendo...,I got the product dirty and dirty... I don’t recommend...,-1.0,-1.0,0.0
"comprei o produto vcs me disseram q entregariam dia 23 mas ate hj não recebi, e vcs não entram em contato para informar sobre a entrega ou a devolução do meu dinheiro, eu estou muito frustada pôs sempre fui cliente das lojas americanas , pós vcs não mostram interesse em resolver o problema eu entro em contato e não respondida. o produto não sei se bom não chaga, mas eu sei as lojas americanas não esta sendo mais uma boa empresa para fazer compras!!!!!!!!!!!!","I bought the product vcs told me q would deliver day 23 but ate hj didn't receive, and vcs don't get in touch to inform about the delivery or the return of my money, I'm very frustrated I've always been a customer of the U.S. stores, after vcs don't show interest in solving the problem I get in touch and didn't answer. the product don't know if good doesn't break, but I know the U.S. stores are not being a good company to make purchases!!!!!!!!!!!!",-1.0,-1.0,0.0
"Normalmente sou de dar 5 estrelas para todas avaliações, não sou muito rigoroso pois pesquiso muito antes de comprar algo. No entanto aqui eu comprei exatamente em 27/11/17 supostamente seria um presente de natal, mas estamos em 02/01/18 e ainda não chegou. A americanas entrou em contato para querer reembolsar o valor, eu não quero reembolso quero o produto que comprei. Espero resolver isso o quanto antes. Fiquei bastante triste com o serviço. A atendente alegou que o produto não havia em estoque, eu me pergunto o porque de vender algo que não se tem. Sem comentários.","Normally I’m giving 5 stars for all reviews, I’m not very strict because I’m searching a long time before buying something. However here I bought exactly on 27/11/17 supposedly would be a Christmas gift, but we’re on 02/01/18 and still didn’t come. The Americans got in contact to want to refund the value, I don’t want refund I want the product I bought. I hope to solve it as soon as possible. I was quite sad with the service. The customer claimed that the product was not in stock, I wonder why to sell something that doesn’t have. No comments.",-1.0,-1.0,0.0
O produto é mto vagabundo o material  não dele nau é bom as gavetas não vale nada7 odiei não recomendo a ninguém,The product is mto vagabundo the material is not his nau is good the boxes are not worth anything7 odiei I don't recommend to anyone,-1.0,-1.0,0.0
"Bom, uma pena pagar esse valor e vir sem o cabo de carregar, vou ter de gastar mais dinheiro com frete pra poder comprar esse cabo, vocês poderiam pensar nisso da prox vez para facilitar a vida do cliente.","Well, it’s worth paying that amount and coming without the charging cable, I’ll have to spend more money with cargo to be able to buy that cable, you could think about it from the next time to facilitate the customer’s life.",-1.0,0.0,0.0
Fiz a compra no mes de março e até agora nada de entregar o produto....nem dão uma satisfação... liguei várias vezes  na central eles confirmam a data da entrega mas essa entrega nunca acontece Estou totalmente decepcionada a pior coisa que fiz foi comprar nessa porcaria desse site não vale nada .... Se não tem condições de atender um cliente melhor não colocar no ar ...  Decepção total.....não recomendo!!!,I made the purchase in the month of March and so far nothing to deliver the product....no give a satisfaction... I called several times at the center they confirm the delivery date but that delivery never happens I am completely disappointed the worst thing I did was to buy in this pork of this site is not worth anything.... If you have no conditions to meet a customer better not put in the air... Total disappointment.....no recommend!!!,-1.0,-1.0,0.0
"Quero saber quando vão entregar meu produto, pq não foi entregue.","I want to know when they will deliver my product, pq was not delivered.",0.0,0.0,0.0
"A imagem do anúncio traz um case rígido preto (entregue) e uma capa emborrachada cor laranja para o HD (NÃO entregue). Ao informar que a capa não foi entregue, recebi uma ligação informando que eu estava enganado, pois esta capa custava R$ 2.000,00. Realmente fui enganado, mas foi por este anúncio enganador e por este atendimento mal caráter. Nem se quer existe um anúncio para esta suposta capa de ""2.000"". O valor é maior que o de um HD, certamente nos acham idiotas, tentando fazer o cliente pensar que o engano é dele mesmo, informando um valor absurdo por um produto que nem é oferecido separadamente. Na própria imagem disponibilizada nesta página de avaliação o case está acompanhado da capa na cor laranja. Anúncio fraudulento, atendimento péssimo! Sou cliente há anos, jamais tive problemas, até esta compra. Este parceiro prejudica a marca Americanas. Jamais pensei depois de anos como cliente receber um atendimento tão ruim e mentiroso.","The image of the advertisement brings a hard box black (introduce) and an embryo orange colour to the HD (not delivered). When informing that the cover was not delivered, I received a link informing that I was misleading because this cover cost R$2,000,00. I was really misleading, but it was for this misleading advertisement and for this bad service character. Neither do you want there is an advertisement for this supposed cover of ""2,000"". The value is greater than that of a HD, they find us stupid, trying to make the customer think that the mistake is of him, informing an absurd value for a product that is not offered separately. In the image itself available in this review page the case is accompanied by the cover.",-1.0,-1.0,0.0
"No dia 22 de fevereiro recebi um produto que não comprei e a comprado e de maior valor pago, não foi entregue. E até hoje entro  contato com a Americanas e a FLIP (loja parceira da americanas). E não resolvem e ainda tiveram a ousadia de dizer que o prazo para reclamações havia expirado. Como se no mesmo dia em que recebi entrei em contato.  AVISO: NÃO COMPREM NADA NELA OU NAS PARCEIRAS, PORQUE SE DER PROBLEMA VCS NÃO TERÃO QUEM RESOLVER E SÓ TERÃO ABORRECIMENTOS, POIS NENHUMA DAS DUAS SE IMPORTAM COM O CLIENTE. EU DEIXEI DE COMPRAR NELAS .AMERICANAS NÃO, FLIP NUNCA MAIS. CLIENTES CUIDADO, ELAS NÃO NOS RESPEITAM. ME SENTI LESADA POR EMPRESAS QUE SE DIZEM PARCEIRAS.","On February 22 I received a product I didn't buy and the purchased and the highest paid value was not delivered. And so far I get in touch with Americanas and FLIP (American partner shop). And they don't resolve and still had the courage to say that the deadline for complaints had expired. As if on the same day I received I entered in contact. Notice: Do not buy anything in it or in the partners, because if the problem VCS won't have anyone to solve and will only be shortcomings, so no one of the two will be concerned with the customer. I've left to buy in the US.",-1.0,-1.0,0.0
"Não existe a versão digital. O produto vem com um código e um site com o caminho para acessar. Porém, o caminho não é válido. Entrei no site da editora e enviei um questionamento. Até hoje sequer tive resposta","There is no digital version. The product comes with a code and a site with the way to access. However, the way is not valid. I entered the publisher's site and sent a questionnaire. So far I even had an answer",-1.0,0.0,0.0
"A entrega foi rápida  o produto veio lacrado e em perfeitas condições! A câmera é  ótima, mas o celular trava!","Delivery was fast the product came tears and in perfect conditions! the camera is great, but the cell phone traps!",0.0,1.0,0.0
Comprei o carrinha em 8 dias foi entregue... no msn diabqbentregou montamos e percebemos q veio com defeito na costura da lateral do carrinho. Liguei na Central da dafito... eles disseram pra entrar em contato com a transportadora. A transportadora buscou o produto ja tem 11 dias e ninguém nem sabe qdo vai devolver outro carrinho! Detalhe: ja paguei pelo produto!!!! Agora  pelo q estou vendo qdo chegar o bebê conforto não sercira mais para minha netinha. Pois se comprei  preciso do produto... agora ficar esperando a Boa vontade da transportadora em ACHAR (rastrear ) ...tenha paciência! Ninguém nunca sabe de nada! E nosso a trouxe aqui ha comprou ... pagou a não recebeu o produto como deveria ! Palhaçada !,I bought the car in 8 days was delivered... in the msn diabqbentregou montamos and we realized q came with a defect in the coat of the side of the car. I called at the center of the dafito... they said to get in touch with the carrier. the carrier sought the product already has 11 days and no one knows qdo will return another car! Details: I already paid for the product!!!! Now for q I am seeing qdo arrive the baby comfort no closure anymore for my grandmother. For I bought precise of the product... now stay waiting for the Goodwill of the carrier in ACHAR (tracking )... have patience! No one knows anything! And our carrier here has paid the product as it should!,0.0,0.0,0.0
"ENGANAÇÃO ! NÃO FUNCIONA NO BRASIL ! Esperei quase um mês e recebi um telefone que não funciona no país. No atendimento telefônico uma sujeita de nome Renata foi absurdamente estúpida e ainda me ameaçou dizendo que a ligação telefônica é gravada Agora é devolver e esperar mais um século pelo estorno PROCUREM OUTRA LOJA !!!!! se ja comprou, faça como eu: processe !","I waited almost a month and I received a phone that doesn’t work in the country. In the telephone service a subject named Renata was absurdly stupid and still threatened me saying that the telephone call is recorded Now it’s to return and wait another a century for the outbreak look for another shop!!!!! if you’ve already bought, do like me: process!",-1.0,-1.0,0.0
"A capa tem uma apresentação legal, mas eu comprei porque dizia na descrição do produto que era IMPERMEÁVEL. No entanto, caiu um líquido sobre a capa e manchou o meu sofá.","The cover has a legal presentation, but I bought because I said in the description of the product that it was IMPERMANENT. However, a liquid fell on the cover and tapped my sofa.",-1.0,0.0,0.0
"Eu já expliquei o motivo de ter cancelado o pedido. Depois de dias de atraso (sem ninguém me dar satisfação), entrei em contato com americanas.com e fui informada de que o produto ainda nem tinha chegado no estoque. Deram um novo prazo (absurdo). Obviamente cancelei o pedido. Um produto barato, vendido em vários sites, que comprei exatamente pelo prazo de entrega. No mesmo dia em que cancelei o pedido, comprei em loja física e por preço mais barato. Decepção pela propaganda enganosa.","I’ve already explained why I canceled the order. After days of delay (without anyone giving me satisfaction), I contacted americanas.com and I was informed that the product had not yet arrived in the stock. They gave a new deadline (absurd). Obviously I canceled the order. A cheap product, sold on several sites, I bought exactly for the delivery deadline. On the same day I canceled the order, I bought in the physical store and at a cheaper price.",-1.0,-1.0,0.0
