review_text,review_translater_face,polaridadeMultiClassifierTweetsOriginal,polaridadeMultiClassifierTweetsTraduzido,polaridade
recebi o produto antes do prazo mas veio com defeito na trava ou seja não da para usar e até agora a Americanas não resolveu e preciso muito deste produto,I got the product before the deadline but came with a defect in the trap that is not to use and so far the American has not resolved and I need a lot of this product,-1.0,-1.0,0.0
"Não compra este produto, pois o mesmo veio com os botões travados e ao tentar ligar o mesmo nem ligou. Péssima qualidade.",Don't buy this product because the same came with the locked buttons and when trying to connect the same didn't connect.,-1.0,-1.0,0.0
"Tive azar, pois o produto não ligou. Tive que entregar para o fornecedor.",I was unfortunate because the product didn't connect. I had to deliver to the supplier.,-1.0,-1.0,0.0
Uma enganação! Esperei quase um mês e cancelaram o pedido. E o produto continua disponível. Nem entraram em contato. Palhaçada!!! #carrodemola,I waited almost a month and they canceled the order. And the product remains available. They didn’t get in touch.,-1.0,-1.0,0.0
Cancelei 10 minutos depois que efetuei a compra e me mandaram mesmo assim,I cancelled 10 minutes after I made the purchase and they sent me even so,-1.0,0.0,0.0
Na estação do som tudo correto mas a estalar os autuofalante não sai som.,In the sound station everything is right but the autofalant does not sound out.,-1.0,-1.0,0.0
"Balcão bonito. Entrega no prazo. Material frágil. Veio faltando parafusos para fixação do tampo, assim como faltou a proteção (cor preta) atrás do tampo, que aparece na imagem. Montagem fácil, mas o manual de instruções poderia ser mais completo. Não recomendo pela falta dos parafusos e da proteção.","Beautiful balcony. Delivery in time. fragile material. came missing pads for fixing the tampon, as well as missed the protection (black color) behind the tampon, which appears on the image. Easy assembly, but the manual of instructions could be more complete. I don't recommend for the lack of pads and protection.",-1.0,-1.0,0.0
Estou decepcionada com o serviço oferecido pela americanas. Venceu o prazo de entrega e não recebi o produto.,I'm disappointed with the service offered by the Americans. I won the delivery deadline and I didn't receive the product.,-1.0,-1.0,0.0
"Bom dia não posso fazer avaliação, pois o produto foi incompatível para rodar no XBOX 360, não havia notado no rodapé da capa que tem que teria que ter o XBOX GOLD, tentei realizar a troca na loja física de Presidente Prudente mais não foi possível.","Good day I can't make an assessment because the product was incompatible to run on the XBOX 360, I didn't notice on the backpack of the cover that I'd have to have the XBOX GOLD, I tried to make the exchange in the physical store of President Prudente more it was not possible.",-1.0,-1.0,0.0
"No primeiro uso já encheu de bolinhas nas mangas, o atrito do moletom cria varias bolinhas.","In the first use already filled with butterflies on the mangas, the moletom scratch creates several butterflies.",-1.0,-1.0,0.0
Acho que o site deveria deixar claro que não é original,I think the site should make it clear that it is not original,0.0,-1.0,0.0
"ainda não recebi meu produto, ainda estou aguardando o recebimento.","I haven't received my product yet, I'm still waiting for receipt.",0.0,0.0,0.0
"Comprei um faz um ano e dois meses, já foi a assistência 2 vezes com o mesmo defeito e o problema não foi solucionou. Smartphone horrível!","I bought one a year and two months ago, it has been the assistance 2 times with the same defect and the problem has not been solved.",-1.0,-1.0,0.0
"Não comprem esse produto, comprei para dar de presente e chegou em casa outro jogo do minecraft  sem as dlcs, Tentei contato com o LIXO da AMERICANAS que só responde com MENSAGEM AUTOMATICA e não dão retorno. Não recomendo! comprar na americanas.com","Don't buy this product, I bought to give a gift and came home another minecraft game without the dlcs, I tried to contact the LIXO of AMERICANES that only responds with AUTOMATIC MESSAGE and don't give a return.",-1.0,-1.0,0.0
Ainda nao recebi o produto então nao tenho como avaliar,I have not received the product yet so I have no way to evaluate.,0.0,0.0,0.0
nossa comprei achando que era um aparelho original infelizmente uma replica .estou chateada o Americana .com eu não esperava receber uma replica de uma rede loja tao grande,Our purchased finding that it was an original device unfortunately a replica.I'm tired the American.com I didn't expect to receive a replica from a big tao store network,-1.0,-1.0,0.0
Não entregaram meu produto e ainda colocaram no sistema que foi entregue no dia 12/12/2017. Tento entrar em contato e eles não me respondem!,They didn’t deliver my product and still put it in the system that was delivered on 12/12/2017. I try to contact and they don’t answer me!,-1.0,-1.0,0.0
Extremamente insatisfeita com o atendimento. Estou aguardando o estorno do pagamento no meu cartão.,I'm very unhappy with the attention. I'm waiting for the payment turn on my card.,-1.0,-1.0,0.0
Comprei o produto com uma voltagem e veio outra. Até agora o problema não foi solucionado.,I bought the product with one voltage and another came. until now the problem has not been solved.,-1.0,-1.0,0.0
"esse produto nem chegou, me roboram na mão grande.  nãi fizeram a entrega, não cumpriram com o prometido não aconselho a ninguem","This product did not come, they stole me in the big hand. they did the delivery, they did not fulfill the promised I do not advise anyone",-1.0,-1.0,0.0
"Quando o telefone chegou, aqui na minha cidade ja estava quase 200.00 mais barato","When the phone arrived, here in my city was almost 200.00 cheaper",0.0,0.0,0.0
Produto chegou amassado  Pedi devolução pelo site e nunca me retornaram com procedimento. Acabei pagando caro por uma panela defeituosa. Não compraria com a polishop novamente.,The product arrived accumulated I asked for return by the site and never returned me with the procedure. I ended up paying expensive for a defective panel. I would not buy with the polishop again.,-1.0,-1.0,0.0
"Acabo de receber o alerta de preço por R$ 577, imediatamente cliquei comprar E JÁ APARECE SEM ESTOQUE!!! Propaganda enganosa é pouco.","I just received the price warning for R$ 577, I immediately clicked to buy AND SHOW WITH STOCK!!!",-1.0,0.0,0.0
"quanto abri o produto, me dei conta de como as vezes comprar pela Internet, pode nos deixar frustados!!!","How much I opened the product, I realized how sometimes buying through the internet, can leave us frustrated!!!",-1.0,-1.0,0.0
gostaria de saber se a parte do recipiente aonde colocamos o óleo conseguimos retirar para lavar.,I would like to know if the part of the container where we put the oil we can remove to wash.,0.0,0.0,0.0
"Não gostei do produto, comprei porque a descrição do site induz ser um objeto de qualidade, profissional etc, todavia, deixou a desejar, feito de alumínio, e o pote para o suco feito de plástico muito grosseiro. Não recomendo! Fui pela descrição e ""  "" toque arrojado do espremedor","I didn't like the product, I bought because the description of the site induces to be a quality object, professional etc, however, left to desire, made of aluminium, and the pot for the juice made of plastic very thick. I don't recommend! I went by the description and "" "" touched the spray",-1.0,-1.0,0.0
Falta me enviar este pote ele ainda não me foi entregue obrigado,Please send me this post he has not yet been delivered thanks,-1.0,0.0,0.0
Eu teria á oposição de troca ou devolução do produto mais meu cunhado não quis fazer o procedimento mais tudo bem espero que os outros dois produtos não venha com defeito.,I would have the opposition of exchange or return of the product more my cousin didn’t want to do the procedure more all well I hope the other two products don’t come with defects.,0.0,-1.0,0.0
"Fiz a compra desse produto no dia 21/02/2018 e até hoje 26/03/2018 não recebi, sendo assim não posso avaliar o produto como bom ou ruim, mas quanto ao fornecedor NÃO RECOMENDO!","I made the purchase of this product on 21/02/2018 and until today 26/03/2018 I didn't receive, so I can't evaluate the product as good or bad, but as to the supplier I NOT recommend!",-1.0,-1.0,0.0
"O produto e si é legal, porém falha e trava muito o que acaba prejudicando um pouco.","The product is good, but it fails and works a lot that ends up damaging a little.",-1.0,-1.0,0.0
Fiz a compra e ainda não recebi o meu pedido. Aguardo até hoje e entrega do mesmo. Ninguém fez contato ainda para avisar dá entrega.,I made the purchase and I have not yet received my order. I wait until today and deliver the same. No one has contacted yet to notify delivery.,-1.0,-1.0,0.0
Não recebi o produto até agora vou comprar em outro lugar e colocar a americana na justiça  já foi pago a primeira  parcela,I didn't get the product until now I'll buy elsewhere and put the American in court already paid the first piece,0.0,-1.0,0.0
As lanternas são muito boas mas ao dei sorte pois elas estão com com diferenças no polimento,The lamps are very good but they are lucky because they are with differences in polishing.,-1.0,1.0,0.0
"O aparelho é bonito, traz boas funções!! Fiquei chateado com seu áudio, que fica em uma escala de regular pra ruim, infelizmente... Acredito que o aparelho poderia ser mais compacto em seu tamanho!","The device is beautiful, it brings good functions!! I’ve been troubled with your audio, which is on a scale of regular to bad, unfortunately... I think the device could be more compact in its size!",-1.0,1.0,0.0
"Ainda não recebi o produto, por favor providencie a entrega, está hiper atrasado, foi prometido para o dia 27 de março, estamos em 6 de Abril","I haven't received the product yet, please provide the delivery, it's hyper delayed, it's promised to the day 27 March, we're on 6 April",-1.0,-1.0,0.0
Não era o que eu esperava e aguardo contato para troca.,It wasn’t what I expected and I’m waiting for contact for exchange.,0.0,-1.0,0.0
Basa muito grossa e para usar com tampo de vidro transparente fica feio pq destaca bastante a base por ser grossa demais. achei o produto de qualidade regular.,Bases very thick and to use with transparent glass tapes becomes ugly pq highlights quite the base because it is too thick. I found the regular quality product.,-1.0,-1.0,0.0
"Produto veio quebrado! Produto veio imundo, tive a impressão que era usado.   LojaTudo nunca mais!  Não tem respeito e muito menos consideração pelos clientes. Na primeira compra feita enviam o produto quebrado e totalmente sujo!   Loja tudo nota 0.  Não comprem na loja tudo! Não compre na loja tudo! loja tudo não! Loja tudo não é boa! Loja tudo entrega produtos quebrados! Loja tudo não é confiável!","Product came broken! Product came dirty, I had the impression that it was used. ShopAll never again! It has no respect and much less consideration by customers. In the first purchase made send the product broken and completely dirty! Shop all note 0. Do not buy in the shop all! Do not buy in the shop all! shop all not! shop all is not good! shop all deliver broken products! shop all is not reliable!",-1.0,-1.0,0.0
O armário  em si é  razoável. Lado negativo é  que veio faltando peça e a Americanas nem se quer uma resposta me deu as 3 vezes que tentei contato!! Não recomendo a  ninguém mais. Pós compra péssimo! Estão nem aí  para os clientes!,The closet itself is reasonable. The negative side is that it came missing piece and the Americans don't want a response gave me the 3 times I tried to contact!! I don't recommend anyone else.,-1.0,-1.0,0.0
"Comprei o produto, paguei um frete altíssimo e após o produto chegar na transportadora ficou quase 30 dias parado sem  movimentação, e sem mais nem menos o produto chegou no endereço de entrega sem que o rastreio fosse atualizado.","I bought the product, paid a very high shipping and after the product arrived at the carrier stood almost 30 days without movement, and without more or less the product arrived at the delivery address without the tracking was updated.",-1.0,-1.0,0.0
"Além de ser caro,o produto é de péssima qualidade,não serve nem para brincar e tampouco para usar na rua,exceto se você for magro ou musculoso. logo sublimado e na parte interna esta todo em branco,as camisas que ganhei nos jogos da seleção dadas pelo Bradesco,apesar de serem descartáveis,tem mais qualidade do que essa nova camisa,R$ 30 para essa camisa é o preço máximo,agora R$ 129? Estão brincando com a minha cara,né?","In addition to being expensive, the product is of poor quality, it doesn't serve neither to play nor to use on the street, except if you're thin or muscular. soon sublimated and inside it's all in white, the t-shirts I won in the games of the selection given by Bradesco, although they're discardable,there's more quality than this new t-shirts,R$ 30 for this t-shirts is the maximum price,now R$ 129?",-1.0,-1.0,0.0
"Além do produto vir sem nota fiscal(o que faz desconfiar da originalidade), mal embalado, veio também com defeito, pois pecisa ficar mexendo no fio pra ajustar o som","In addition to the product coming without a tax note(which makes you doubt the originality), badly packed, came also with a defect, because it gets moving on the thread to adjust the sound",-1.0,-1.0,0.0
Recomendo que me devolvam o dinheiro e me mande uma carta pedindo desculpa pela LIXO que eu comprei. Sacanagem e enganação. Nao sei como a americanas deixa oferecer um produto de LIXO como isso ai...LIXO LIXO LIXO  Isso parece uma meia velha mesmo...alguem ja falou isso ai embaixo..LIXO,I recommend that you return me the money and send me a letter apologizing for the LIXO I bought. scam and deceit. I don't know how the Americans let offer a LIXO product like this ai...LIXO LIXO LIXO It looks like a half old even...somebody has already said this ai below..LIXO,-1.0,-1.0,0.0
"Tive o pedido cancelado pelo site, após ter pago. Um desrespeito.","I had the order cancelled by the site, after having paid.",-1.0,-1.0,0.0
"Acabei de abrir e o segredo digital não funciona. Só abre e fecha na chave. Teclado inoperante. Estou decepcionado. Acabei arrumando um problema. Espero que consiga trocar. Já descobri, pesquisando, que o pós-venda é ruim. É muito frustrante isso. Primeira vez que me chateio com as lojas americanas. Já tinha comprado outras vezes. Vou continuar acreditando nas L.A. Mas não recomendo o produto. Lamentável. Queria estar aqui elogiando. Mas não posso.","I just opened and the digital secret doesn’t work. Just open and close on the key. Unfunctionable keyboard. I’m disappointed. I’ve finished fixing a problem. I hope you can exchange. I’ve already discovered, researching, that post-sales is bad. It’s very frustrating that. First time I get bored with the American stores. I’ve already bought other times. I’m going to continue believing in the L.A. But I don’t recommend the product. Sorry. I wanted to be here praising. But I can’t.",-1.0,-1.0,0.0
"Cada um que compro vem com um firmware (programa) diferente, o que compromete a qualidade do produto, pois alguns deles travam e todos superaquecem, tenho a impressão de que vai queimar a qualquer momento. O da marca NOVA DIGITAL é o que menos recomendo, pois trava os canais (com boa antena) e apresenta problemas de configuração. O da VMADE (Made) altera a ordem dos canais por conta própria. Péssimos softwares nesse modelo de equipamento. Sou técnico em eletrônica.","Everyone who purchases comes with a firmware (program) different, which compromises the quality of the product, because some of them brake and all overheat, I have the impression that it will burn at any time. The brand NEW DIGITAL is what least I recommend, because it brake the channels (with good antenna) and presents configuration problems. The VMADE (Made) changes the order of the channels on its own.",-1.0,-1.0,0.0
"O produto veio certinho, é fácil de encher. Porém tem pouca durabilidade!","The product came certain, it is easy to fill. but it has little durability!",-1.0,0.0,0.0
"O aparelho veio com defeito e vcs dizem q passou do tempo para reclamar. E que eh para eu entrar em contato com o fornecedor. Que eu me lembre eu comprei das americanas! Entrei no site das americanas por confiar em vocês. Não compro em quem não conheço. Ou seja, não adiantou nada. Péssima experiência! Agora estou com um produto pifado, sem funcionar, caro e eu que vou ter que correr atrás pra resolver e vcs se eximem do problema. Muito obrigado pelo péssimo atendimento! Evitarei futuras compras com vcs.","The device came with a defect and vcs say q passed time to complain. And that eh for me to contact the supplier. Let me remember I bought from the Americans! I entered the site of the Americans for trusting you. I don't buy in who I don't know. That's, it didn't advance anything. Bad experience! Now I'm with a packed product, not working, expensive and I'm going to have to run back to solve and vcs get rid of the problem. Thank you very much for the bad care! I'll avoid future purchases with vcs.",-1.0,-1.0,0.0
NÃO RECOMENDO TAPETE DE PÉSSIMA QUALIDADE BEM DIFERENTE DA FOTO SEM SE COMPARA.,I do not recommend a very good quality tape different from the picture without comparing it.,-1.0,-1.0,0.0
As dimensões desta caixa de verramentas no anúncio é de 16 cm x 16 cm x 11 cm.  Não cabe nada é muito pequena,The dimensions of this toolbox in the ad is 16 cm x 16 cm x 11 cm.,-1.0,0.0,0.0
"O encosto veio com vários arames amassados, falha na pintura da banqueta e o acabamento é péssimo, muitas rebarbas inclusive machucando, arranhou o braço ao passar; Poderia ter caprichado mais para entregar o produto, ninguém olha o produto antes de embalar?","The crossing came with several arams accumulated, fails in the painting of the banquet and the finish is bad, many rebounds even hurting, scratched the arm when passing; Could you have capriched more to deliver the product, no one looks at the product before packing?",-1.0,-1.0,0.0
"Porque não recebi nada,e no site já até confirmaram que eu recebi e aí como fico?","Why didn't I get anything, and on the site they even confirmed that I got and there how I'm?",-1.0,-1.0,0.0
Achei a recepção muito ruim dos canais. Tenho uma do mesmo estilo de outra marca q funciona perfeitamente.,I found the very bad reception of the channels. I have one of the same style of another brand q works perfectly.,-1.0,-1.0,0.0
"Não  gruda todos pelos e muito menos qdo vai limpar pra passar de novo, limpa muito poucp","Not grid all the hair and much less qdo will clean to pass again, clean very poucp",0.0,0.0,0.0
No anúncio é duralex mas produto é marinex .. qualidade muito inferior .. fiz a devolução do produto faz mais de um mês e ainda não fui reembolsado !! Muito insatisfeito com essa empresa,In the ad is duralex but the product is marinex.. very low quality.. I made the return of the product more than a month ago and I was not yet refunded!!,-1.0,-1.0,0.0
Não tem oque falar do Game. minha reclamação e com a demora na entrega.,It’s not good to talk about the game. my complaint and with the delay in delivery.,-1.0,-1.0,0.0
"Não recomendo, pois comprei pq achei baratinho e estava precisando, nunca recebi. Já está com quase 3 meses e eles não me deram nem satisfação, todos os dias tento um retorno e nada.","I don't recommend, because I bought pq I found cheap and I needed it, I never received it. It's already almost 3 months and they didn't give me any satisfaction, every day I try a return and nothing.",-1.0,-1.0,0.0
"A propagando nos levar crer que estamos comprando um produto de alta pressão. Pois além da potencia técnica ser 1750 Lbs o nome do Produto leva a grafia de ""2200 que confunde completamente o consumidor leigo. Comparei as 1750lbs da Lavadora Wap com as 1750Lbs do concorrente (TEKNE) e fiquei surpreso com a diferença. Por isso não recomendo este produto.","The spreading leads us to believe that we are buying a high-pressure product. For in addition to the technical power to be 1750 Lbs the name of the product leads the graphic of ""2200 that completely confuses the consumer light. I compare the 1750 Lbs of the Wap Washer with the 1750 Lbs of the competitor (TEKNE) and I was surprised by the difference.",-1.0,0.0,0.0
Apesar do prazo estar vencido o produto não foi entregue conforme descrito. Estou aguardando a entrega o mais rápido possível!,Despite the deadline being passed the product has not been delivered as described. I am waiting for delivery as soon as possible!,0.0,0.0,0.0
"O produto veio com defeito, o telefone do Sac da Americanas.com nunca funciona (sempre manda ligar depois, porque todos os atendentes estão sempre ocupados), entrei no reclame aqui...baita transtorno até conseguir fazer a troca. Nesse meio tempo mudei de endereço (de estado!) e a política de troca não aceita que se mude o endereço de entrega. Me articulei com os pais da criança que havia presenteado, com o zelador do prédio e a nova moradora para, por fim, chegar a boneca, funcionar por menos de 10 min, e pifar! Chega um vídeo do pai dela no meu celular com a mensagem ""Descartável, já travou o motor"" acompanhada de um vídeo comicamente deprimente: a boneca girando na base, e a música toda distorcida... não gastem seu suado dinheirinho com essa porcaria.","The product came with a defect, the phone of the Americanas.com Sack never works (always send call after, because all the attendees are always busy), I entered the complaint here...low disorder until I managed to make the exchange. In that middle time I changed the address (state!) and the exchange policy does not accept that the delivery address is changed. I articulated with the parents of the child that had presented, with the building wardrobe and the new resident to, finally, get the doll, work for less than 10 minutes, and pifar! Comes a video of her father on my cell phone with the message ""Descartable, already trapped the engine"" accompanied by a video with a beautifully printing: the turn on the base, and all the distortion music...",0.0,-1.0,0.0
Solicitei devolução e até o momento não obtive retorno.,I requested a refund and for now I have not received any refund.,-1.0,-1.0,0.0
"comprei essa tv dia 24/01 ate hoje 27/02 nunca foi entregue, no status da transportadora diz que minha tv esta retida sob fiscalizacao, o que diabos tenho haver com isso..sempre compro na americana, mas sinceramente dessa vez estou decepcionada, dar proxima vez vou procurar outros sites.","I bought this TV on 24/01 until today 27/02 was never delivered, in the status of the carrier says that my TV is held under surveillance, what diabos I have with it..all I buy in the American, but honestly this time I am disappointed, give next time I will look for other sites.",-1.0,-1.0,0.0
"O produto é muito bom, porém deu defeito em 20 dias de uso",The product is very good but has been defective in 20 days of use.,-1.0,-1.0,0.0
Não e o original.. Não tive resultados... Só o shake que e bom,Not the original... I didn’t have results... Only the shake that was good,0.0,0.0,0.0
Cancelaram o meu pedido porque não tinha o produto e ainda pedem avaliação,They cancelled my order because I didn’t have the product and still ask for review,-1.0,-1.0,0.0
Ridiculo isso um site grande desse me enviar um produto errado; e agora quem vai ir atraz pra trocar? Eu com um bb recen nascido; RIDICULO AMERICANAS,I laugh this a great site of this send me a wrong product; and now who will go attractive to exchange? I with a newborn bb; RIDICULO AMERICANES,-1.0,-1.0,0.0
"Se existisse 0 estrelas eu daria. Não para o produto, mas para a loja que me enviou um produto péssimo, que nem marca tem, totalmente divergente. Faz semanas que estou pedindo que eles me enviem o código para eu postar o produto e receber o estorno mas ainda estou na espera. Totalmente insatisfeita","If there were 0 stars I would give. Not to the product, but to the store that sent me a bad product, which no brand has, completely different. For weeks I’m asking them to send me the code to me post the product and receive the distortion but I’m still waiting.",-1.0,-1.0,0.0
"Comprei esse produto e paguei à vista, através de boleto. Agora alegam que não há estoque e ninguem me dá uma posição. Não recomendo de jeito nenhum pois na hora de fechar o pedido não há nenhum aviso que o produto está em falta.","I bought this product and paid in sight, through a ticket. Now they claim there is no stock and no one gives me a position. I do not recommend in any way because at the time of closing the order there is no warning that the product is missing.",-1.0,-1.0,0.0
O revolver aplicador vaza muito na conexão e não é possível utilizar a mangueira sem o mesmo,The revolver applicator is very empty in the connection and it is not possible to use the handle without the same,-1.0,-1.0,0.0
"apresentou defeito depois de 11 dias de uso 3 riscos horizontais na imagem, a tv não saiu da parede, vou enviar p assistência técnica amanha, e como passou o prazo de 5 dias corridos depois da entrega, só a assistência técnica q resolve.","presented defect after 11 days of use 3 horizontal risks in the image, the TV did not come out of the wall, I will send p technical assistance morning, and as passed the period of 5 days run after delivery, only the technical assistance q solves.",-1.0,-1.0,0.0
